{
  "slug": "mechanical-bull-charge-the-beasts-are-coming-720815",
  "title": {
    "en": "Mechanical bull charge The Beasts Are Coming",
    "zh": "机械公牛冲锋·野兽将至"
  },
  "description": {
    "en": "Controls a Harvester-universe charge where a rider mounts a battle-scarred mechanical bull and storms into fog-bound enemies.",
    "zh": "控制收割者宇宙冲锋戏：骑手跃上战痕累累的机械公牛，冲入雾中敌人。"
  },
  "category": "cinematic-story",
  "mode": "reference-to-video",
  "duration": "15s",
  "aspectRatio": "16:9",
  "ingredients": [
    "mechanical bull",
    "rider character",
    "ruined industrial lane",
    "furnace charge"
  ],
  "source": {
    "kind": "x",
    "name": "@rahulnanda86",
    "url": "https://x.com/rahulnanda86/status/2083033635364720815"
  },
  "outputStatus": "source-verified",
  "promptVisibility": "same-post",
  "promptSourceUrls": [
    "https://x.com/rahulnanda86/status/2083033635364720815"
  ],
  "prompt": "Use the uploaded mechanical bull image as the primary reference for the bull, and use Rahul’s image as the character reference for the rider.\n\nCreate a 15-second ultra-realistic cinematic fantasy-sci-fi sequence set in The Harvester universe. The setting is a foggy ruined industrial lane at dawn or overcast light, with drifting smoke, hanging wires, broken stone and metal structures, wet ground, ash in the air, and distant furnace glow. The giant mechanical bull is ancient, battle-scarred, and alive with furnace energy inside its cracked armor.\n\n0–3s — Hook: Start with Rahul stumbling backward into frame, breathing hard, turning to face danger in the smoke behind him. The giant mechanical bull stands in front of him like a wall, half-silhouetted in steam, protecting him.\n\n3–6s: Close on Rahul placing one hand on the bull’s armored side, steadying himself. He looks at it with trust, not fear. The bull turns its head slightly toward Rahul. Its eye glows brighter, and its internal furnace begins to pulse.\n\n6–9s: A loud metallic roar echoes from somewhere in the fog ahead. The bull reacts instantly — it lowers its head, paws the ground, steam blasts from its vents, gears lock into place, and sparks spit from its chest cavity. Rahul pulls himself up and mounts the bull in one fast motion.\n\n9–12s: The bull rears slightly, then slams down hard. Rahul leans forward, gripping tight. Through the smoke ahead, we briefly see threatening silhouettes moving toward them, just enough to imply incoming enemies.\n\n12–15s — Payoff: The bull explodes forward into a full charge with Rahul riding it, smashing through smoke and embers. End on a powerful low-angle tracking shot as both disappear into the haze, charging straight toward the unseen threat.\n\nSound: deep metal groans, steam bursts, furnace rumble, distant enemy roar, hoof impact, sparks, low cinematic score.\n\nCinematography / Color Brief\n\nUse the same signature look: desaturated steel blue, charcoal grey, mist white, weathered bronze, and restrained furnace orange accents. Soft overcast light, smoky atmosphere, wet surfaces, and strong depth. Cinematography should feel premium and mythic: low angles, slow dramatic push-ins, tactile detail, subtle shake, sharp realism, and heavy scale."
}
