{
  "slug": "rhythmic-photo-diary",
  "title": {
    "en": "Rhythmic photo diary",
    "zh": "节奏照片日记"
  },
  "description": {
    "en": "Convert everyday photos into a tactile, music-led vertical diary with editorial captions.",
    "zh": "把日常照片变成有触感、跟随音乐节奏的竖屏影像日记。"
  },
  "category": "vlog",
  "mode": "reference-to-video",
  "duration": "15s",
  "aspectRatio": "9:16",
  "ingredients": [
    "Five trip photos",
    "Music excerpt"
  ],
  "source": {
    "kind": "beatapi-original",
    "name": "BeatAPI Editorial",
    "url": "https://github.com/BeatAPI/awesome-minimax-h3-prompts/blob/main/prompts/rhythmic-photo-diary.json"
  },
  "outputStatus": "template-unverified",
  "prompt": "Create a 15-second vertical photo diary from Images 1 through 5 and synchronize its pacing to Audio 1. Keep every person's identity, clothing, and location faithful to the references. Treat the images as physical prints on a sunlit editing table: a hand-drawn route line connects one image to the next, shadows shift naturally, and small date-stamp labels appear only with the exact text supplied in Image 5. Use match cuts based on similar shapes rather than random transitions. Alternate two calm holds with three faster beats, then slow down for the final image. The visual language is warm documentary photography, off-white paper, blue pencil marks, and gentle 35 mm grain. No synthetic scenery, face morphing, extra people, generic travel slogans, or watermark."
}
