{
  "slug": "mumbai-monsoon-fpv-drone-flight-942674",
  "title": {
    "en": "Mumbai monsoon FPV drone flight",
    "zh": "孟买季风 FPV 航拍穿越"
  },
  "description": {
    "en": "Controls a continuous FPV drone path over monsoon Mumbai, locking the reference skyline and flight-path guide without showing the guide line.",
    "zh": "控制季风中的孟买 FPV 连续航拍路径，锁定参考天际线与飞行轨迹指引且不显示辅助线。"
  },
  "category": "cinematic-travel",
  "mode": "image-to-video",
  "duration": "15s",
  "aspectRatio": "3:4",
  "ingredients": [
    "first-frame cityscape",
    "FPV flight path",
    "monsoon rain",
    "Mumbai interchange"
  ],
  "source": {
    "kind": "x",
    "name": "@CurieuxExplorer",
    "url": "https://x.com/CurieuxExplorer/status/2082747871103942674"
  },
  "outputStatus": "source-verified",
  "promptVisibility": "same-post",
  "promptSourceUrls": [
    "https://x.com/CurieuxExplorer/status/2082747871103942674"
  ],
  "prompt": "Reference: Use the attached @ Image1  1 as the exact first frame and environment reference. The green drawn line is only the camera flight-path guide. Do not show the green line in the final video.\n\nCreate a 15-second hyper-real cinematic FPV drone video over Mumbai in heavy monsoon weather, using the same skyline, interchange, sea edge, road geometry, dense buildings, rainy morning atmosphere, grey clouds, and wet surfaces from the reference image. Keep everything realistic and grounded.  The drone must follow the green guideline path as a smooth continuous move: begin near the left side of the interchange, rise and sweep across the middle highway corridor, continue through the right-side city edge, then climb higher into the skyline, perform a tight spiral/orbit near the upper tower cluster, descend back toward the interchange, curve around the large circular loop, and finally glide out toward the lower-right water edge. The move should feel fast, elegant, immersive, and controlled — like a premium FPV drone shot, not a random flyover.\n\nTIMELINE\n\n 0:00–0:03 Start low near the left feeder ramp above the wet interchange. Heavy rain falls across the lens. The drone accelerates forward and slightly upward, revealing slick roads, tiny moving traffic, dark sea barriers, and the circular loop ahead.\n\n0:03–0:06 Follow the path upward across the mid-frame highway corridor. Keep the skyline growing larger. Wet roads shimmer, rain haze softens the distance, and the sea remains visible to the right. Motion is quick but readable.\n\n0:06–0:09 Sweep along the right-side city edge and climb higher. Dense towers, mid-rise blocks, and dark green patches below feel soaked and monsoon-heavy. The camera begins rising toward the upper skyline.\n\n0:09–0:11 Reach the upper skyline cluster and perform a tight spiral/orbit around the central high-rises. Storm clouds loom above, rain streaks rush past, and the city beneath feels deep, layered, and cinematic.\n\n0:11–0:13 Exit the spiral and descend in a smooth arc back toward the interchange. The circular loop becomes dominant again. Maintain realistic drone inertia and readable geography.\n\n0:13–0:15 Curve around the large circular flyover loop and finish with a fast glide toward the lower-right over the water, ending on a dramatic monsoon reveal of wet infrastructure, dark sea, and rain-washed Mumbai.\n\nCAMERA LANGUAGE  FPV drone POV, smooth stabilized flight, realistic banking turns, slight motion blur from speed and rain, believable acceleration and inertia, one continuous shot, no teleporting, no abrupt cuts, no impossible passes through buildings.\n\nVISUAL STYLE  Hyper-real cinematic realism, heavy monsoon rain, grey storm clouds, wet roads, reflective flyovers, rain haze, cool blue-grey morning light, dark sea, atmospheric depth, realistic Mumbai scale, premium documentary-film look.\n\nAUDIO  No voiceover. No dialogue. Use heavy rainfall, rushing wind, distant thunder, soft drone motor whirr, faint traffic hum, sea movement, and subtle cinematic tension music building with the motion.\n\nIMPORTANT  Do not show the green route line. No text, captions, logos, or watermark. Keep Mumbai realistic, monsoon-heavy, and geographically believable."
}
