{
  "slug": "kaldr-cold-perfume-commercial-multi-reference-943073",
  "title": {
    "en": "KALDR cold perfume commercial multi-reference",
    "zh": "KALDR 极冷香水多模态广告"
  },
  "description": {
    "en": "Controls a multi-reference cold fragrance film combining bottle, brand lockup, beach location, character sheet, and a matched spoken-voice line.",
    "zh": "控制多参考极冷香水片：瓶身、品牌锁图、黑沙滩、角色设定与对白音色精确对齐。"
  },
  "category": "product-commercial",
  "mode": "multimodal",
  "duration": "15s",
  "aspectRatio": "640:271",
  "ingredients": [
    "KALDR bottle image",
    "brand lockup image",
    "volcanic beach location",
    "spoken voice audio"
  ],
  "source": {
    "kind": "x",
    "name": "@abulu8",
    "url": "https://x.com/abulu8/status/2082919486399943073"
  },
  "outputStatus": "source-verified",
  "promptVisibility": "same-author-thread",
  "promptSourceUrls": [
    "https://x.com/abulu8/status/2082919493060514051"
  ],
  "prompt": "REFERENCE USAGE:\nImage 1 — the KALDR bottle. Preserve the smoked charcoal glass, bevelled edges, pale blue liquid, brushed gunmetal cap and the etched silver KALDR mark exactly.\nImage 2 — the closing brand lockup. Preserve the letterforms, tracking, silver finish and the COLD KEEPS line exactly. It appears only in the final shot, alone on black.\nImage 3 — the location, palette, cloud, surf and film texture for the whole film.\nImage 4 — a three panel character sheet of the woman. Use it only to match her face, hair, frost detail and black greatcoat. Do not reproduce the sheet's panel layout, its grey backdrop or its flat studio lighting. She must appear as a single person inside the Image 3 environment, lit by that location.\nAudio 1 — the voice for the woman's spoken line. Match its timbre, pitch, accent, breathiness and pacing exactly. Use it only for her voice, not as background audio or ambience.\n\nPremium luxury fragrance brand film. Photoreal 35mm anamorphic, high contrast, fine grain, cold specular highlights, deep crushed blacks. Palette strictly black sand, gunmetal, glacial blue and silver, with no warm tones anywhere. Setting: a black volcanic beach on a northern coast at blue hour under heavy storm cloud. Tone: severe, violent, expensive. This is a fast, aggressive fashion edit, not a calm product film. Never slow, never ceremonial, never a slideshow of pretty holds.\n\n[0-1.5s] Cold open, no establishing shot. Camera at water level, lens half submerged, [Static shot]. A sheet of freezing surf races straight at the lens. Her boots stride hard into frame through the water, coat hem whipping. HARD CUT.\n\n[1.5-2.6s] Extreme macro insert. Frost crystals race across black glass and flood the etched KALDR mark with rime, filling the letters. HARD CUT.\n\n[2.6-4.2s] Behind her, low and close, [Tracking shot] pushing fast. She walks straight into an oncoming wave that towers over her, coat streaming sideways, never breaking stride. HARD CUT.\n\n[4.2-5.4s] Reverse, low angle from the water. The wave collapses over her. Camera [Shake] on the impact. Cut on the peak of the white spray. HARD CUT.\n\n[5.4-9s] SLOW MOTION. The wave freezes solid around her mid collapse. She stands inside a shell of blue black ice, the spray suspended in the air as a thousand hanging shards, her coat frozen mid snap, her face calm and unbothered. Camera [Tracking shot] orbits right through the suspended shards, holding her at centre. This is the hero image of the film.\n\n[9-9.8s] Snap back to real time. The ice shell detonates outward. Camera [Pull out] fast and hard through the exploding shards. HARD CUT.\n\n[9.8-12.6s] Tight close up, [Push in]. She walks out of the collapsing ice straight at the lens, ice water running off her coat, looking directly into camera. She says quietly: \"I was never meant to melt.\" She holds the look for a beat after the line. HARD CUT.\n\n[12.6-13.8s] The bottle alone, upright on wet black sand, shot low and close on a macro lens. Frost blooms outward from its base toward the lens. No text of any kind in this shot. HARD CUT.\n\n[13.8-15s] Pure black frame. The brand lockup from Image 2 appears alone, centred, exactly as in the reference. The wordmark KALDR emerges from darkness at low opacity, letter spacing opening over 0.4 seconds into sharp focus with a faint edge glow, and the line COLD KEEPS sits smaller beneath it. Nothing else is in this frame. Critical: the bottle, the woman, the beach and the wordmark must never share a frame. The lockup must never overlap or be occluded by the bottle, and the etched mark on the glass must never appear in the same shot as the lockup. Hold the lockup to the end.\n\nDialogue and lip sync: only one line is spoken, in the shot beginning at 9.8 seconds: \"I was never meant to melt.\" Match the voice in Audio 1 exactly, including its timbre, breathiness, pacing and the way the sentence lands without rising at the end. Do not substitute a different voice, do not add reverb or processing that changes its character. Her lip movement must match the words frame accurately and stop when the line ends. Her breath fogs on the words. Do not repeat the line and do not add any other spoken words anywhere in the film.\n\nPacing: hold every cut until its stated timecode and do not shorten the last two shots. The first four shots are fast and aggressive. The slow motion shot is the only long hold in the film. Everything after it is fast again.\n\nAudio: hard coastal wind, heavy surf, a low sub bass drone. At 5.8 seconds, one deep impact hit, a splintering glass freeze crackle and a reversed swell. Then cut the wind, the surf and all low end to complete silence from 6 seconds to 9 seconds, leaving only isolated ice ticks and faint crystal ring in that window. This silence is mandatory and must be obvious. At 9 seconds the full mix slams back in with a hard low kick and the crash of shattering ice into water. As she speaks, duck the wind, surf and low end so her voice sits forward and dry. The final second holds one sustained low string chord decaying into wind. No voiceover, no narrator, no lyrics, no recognisable melody.\n\nDo not add other people, boats, buildings, vehicles, modern objects, subtitles, on screen captions, watermarks, or any text other than specified. Do not warp or distort the bottle or the wordmark. No cartoon or plastic CGI water or ice. Keep skin texture real, no over smoothing. Never let the ice or spray form a face, eyes, or a creature."
}
